### ISSUE TITLE
1.0 连接池的一些建议

### ISSUE THREAD

**Issue by phenixsoul** [swoft-cloud/swoft#685]
生产环境，rpc调用偶尔出现 110 connection time out，服务器负载正常，tcp内核参数也配置了足够多的 tcp_max_syn_backlog 和 somaxconn，并发量2压测1分钟，必然会出现 协程 client recv 超时，抛出110错误。

经过好几天的测试，客户端用tcpdump抓包发现了问题，日志如下：
`12:09:29.486940 IP iZbp18h5npu8bhnq91u4iyZ.54076 > 102.181.161.121.micromuse-ncpw: Flags [P.], seq 668439993:668440274, ack 1433023975, win 229, options [nop,nop,TS val 448033401 ecr 549836154], length 281
12:09:29.488787 IP 102.181.161.121.micromuse-ncpw > iZbp18h5npu8bhnq91u4iyZ.54076: Flags [P.], seq 1:83, ack 281, win 436, options [nop,nop,TS val 549882129 ecr 448033401], length 82
12:09:29.488801 IP iZbp18h5npu8bhnq91u4iyZ.54076 > 102.181.161.121.micromuse-ncpw: Flags [.], ack 83, win 229, options [nop,nop,TS val 448033403 ecr 549882129], length 0
12:09:29.489565 IP iZbp18h5npu8bhnq91u4iyZ.54076 > 102.181.161.121.micromuse-ncpw: Flags [P.], seq 281:561, ack 83, win 229, options [nop,nop,TS val 448033403 ecr 549882129], length 280
12:09:29.491174 IP 102.181.161.121.micromuse-ncpw > iZbp18h5npu8bhnq91u4iyZ.54076: Flags [P.], seq 83:165, ack 561, win 444, options [nop,nop,TS val 549882131 ecr 448033403], length 82
12:09:29.524188 IP iZbp18h5npu8bhnq91u4iyZ.54076 > 102.181.161.121.micromuse-ncpw: Flags [P.], seq 561:842, ack 165, win 229, options [nop,nop,TS val 448033438 ecr 549882131], length 281
12:09:29.525959 IP 102.181.161.121.micromuse-ncpw > iZbp18h5npu8bhnq91u4iyZ.54076: Flags [P.], seq 165:247, ack 842, win 453, options [nop,nop,TS val 549882166 ecr 448033438], length 82
12:09:29.526679 IP iZbp18h5npu8bhnq91u4iyZ.54076 > 102.181.161.121.micromuse-ncpw: Flags [P.], seq 842:1122, ack 247, win 229, options [nop,nop,TS val 448033440 ecr 549882166], length 280
12:09:29.528398 IP 102.181.161.121.micromuse-ncpw > iZbp18h5npu8bhnq91u4iyZ.54076: Flags [P.], seq 247:329, ack 1122, win 461, options [nop,nop,TS val 549882168 ecr 448033440], length 82
12:09:29.567725 IP iZbp18h5npu8bhnq91u4iyZ.54076 > 102.181.161.121.micromuse-ncpw: Flags [.], ack 329, win 229, options [nop,nop,TS val 448033482 ecr 549882168], length 0
12:09:29.634872 IP iZbp18h5npu8bhnq91u4iyZ.54076 > 102.181.161.121.micromuse-ncpw: Flags [P.], seq 1122:1403, ack 329, win 229, options [nop,nop,TS val 448033549 ecr 549882168], length 281
12:09:29.636662 IP 102.181.161.121.micromuse-ncpw > iZbp18h5npu8bhnq91u4iyZ.54076: Flags [P.], seq 329:411, ack 1403, win 470, options [nop,nop,TS val 549882276 ecr 448033549], length 82
12:09:29.636678 IP iZbp18h5npu8bhnq91u4iyZ.54076 > 102.181.161.121.micromuse-ncpw: Flags [.], ack 411, win 229, options [nop,nop,TS val 448033550 ecr 549882276], length 0
12:09:29.637466 IP iZbp18h5npu8bhnq91u4iyZ.54076 > 102.181.161.121.micromuse-ncpw: Flags [P.], seq 1403:1683, ack 411, win 229, options [nop,nop,TS val 448033551 ecr 549882276], length 280
12:09:29.638921 IP 102.181.161.121.micromuse-ncpw > iZbp18h5npu8bhnq91u4iyZ.54076: Flags [P.], seq 411:493, ack 1683, win 478, options [nop,nop,TS val 549882279 ecr 448033551], length 82
12:09:29.678721 IP iZbp18h5npu8bhnq91u4iyZ.54076 > 102.181.161.121.micromuse-ncpw: Flags [.], ack 493, win 229, options [nop,nop,TS val 448033593 ecr 549882279], length 0
12:09:29.701064 IP iZbp18h5npu8bhnq91u4iyZ.54076 > 102.181.161.121.micromuse-ncpw: Flags [P.], seq 1683:1964, ack 493, win 229, options [nop,nop,TS val 448033615 ecr 549882279], length 281
12:09:29.702757 IP 102.181.161.121.micromuse-ncpw > iZbp18h5npu8bhnq91u4iyZ.54076: Flags [P.], seq 493:575, ack 1964, win 486, options [nop,nop,TS val 549882343 ecr 448033615], length 82
12:09:29.702772 IP iZbp18h5npu8bhnq91u4iyZ.54076 > 102.181.161.121.micromuse-ncpw: Flags [.], ack 575, win 229, options [nop,nop,TS val 448033617 ecr 549882343], length 0
12:09:29.703437 IP iZbp18h5npu8bhnq91u4iyZ.54076 > 102.181.161.121.micromuse-ncpw: Flags [P.], seq 1964:2244, ack 575, win 229, options [nop,nop,TS val 448033617 ecr 549882343], length 280`

在并发少的情况下，swoft长期复用个别长连接，导致其他长连接长时间得不到使用，如果没有keeplive机制，时间一长，其他长连接会发生断开，一旦被复用的两个长连接拥挤，需要启用新的长连接，协程client会发生send成功，recv超时，报110错误。

这里暴露出了两个问题，
1：keeplive 机制，如果服务端没做，那么协程client很容易出问题，而且排查困难
2、长期复用个别长连接是否合理？轮询是否更优一些

**Comment by stelin** [comment]
@phenixsoul 2.0已发布，建议升级到2.0
